id,text
166,Horrible! I ordered 3 pc box w/ all white meat. I got 3 pc's but all dark meat. The coating was gummy/ doughy/ horrible. Also ordered (2) 3 pc tenders....
167,I'm a delivery driver. I come to this location all the time. Everything usually is fine. Yesterday 07/06/20 around 8pm I came to pick up a delivery. They...
168,"Over the years (50 or so), I have had many, many pieces of fried chicken from homemade, local diners, grocery store delis, and large chain restaurants, but..."
169,The temperature in this place is always sub 65 degrees. Which may explain why at high noon less than 15% of the place is filled. They did at least fix the...
170,"Worst chicken joint in Dallas. Went to Drive Thru. Placed a order. They didn't have sweet tea!! Who doesn't have sweet tea. Went to Popeyes.,,"
171,Probably the worst KFC I've ever eaten from. The wings were pretty inedible because they were cooked so hard that even the bones were brittle. Not to...
172,Cashier not knowledgeable about menu. Tone very dry. Makes a customer walk out. I didnt. I just would not recommend this location
173,"Placed on order through Yelp. My fiancé loves the the KFC pot pie. Unfortunately when she got home after picking it up, it was some mixed bowl rather than a..."
174,This is one of the worst locations I've ever been to. They completely got my order wrong. In addition there were three other people in the drive-through...
175,Famous bowl but no corn? this location is always out of something and def has one too many rude staff members.
176,"Horrible customer service. When I pulled up at the window the guy taking my order sounded so damn pissed off. ""KFC what do you want"" is how he greeted me...."
177,I took a bite out of the chicken and the jalapeño but the jalapeño was bigger than my baby chick drum stick !! The chicken is aooo good but cmon the size...
178,I have to be brutally honest with my fellow yelpers. This location is a hit and miss with me. Been to this place on many occasions including today and the...
179,Caution **** Only Eat here if nothing else is open!!!! Let's just start of by saying that this a probably one of those businesses where the little...
180,Told me its a 20 min wait on a family deal. Cmon man! Popeyes is right across the street. Why you keep losing money?
181,I'm not even wanting to give this 1 star! Didn't want to talk back in for the honey that was forgotten and said the truck didn't come in. We go in and low...
182,They obviously don't want it need any business. Tried to Eat there but they wouldn't let customers use their restroom. What do the employees use? I'll go...
183,"Dirty location, rude staff who don't even acknowledge or look up from their cell phone when you come up to the counter, incorrect orders, mediocre/cold..."
184,"I just left this location and I was there for about 30 minutes in the drive thru. It advertised they were offering free lemonde upgrades with the combo, so..."
185,"Had drive thru on Sunday 7-12-20 & ordered 4pc grilled chicken meal. The chicken tasted dry & old, the biscuit wasn't fresh & was rock hard & no butter in..."
186,I swear every time I come here it reminds me why I hate it. The employees treat you like they don't want to be at work. No customer service skills. All i...
187,"I ordered the three-piece combo original of course, but they serve me old chicken instead I thought original chicken was supposed to be a soft chicken but..."
188,"This place was the worst ever . They gave me the wrong food , and besides when I opened my bag a really strong smell came out it smelled like if someone..."
189,This place never gets my order right. It doesn't matter if they repeat it back to me by the time I get my food my order is wrong. And they are the rudest...
190,"Fresh hot tasty food with great customer service and the correct order is not something you will find here, DT person was extremely cold at the speaker and..."
191,"The sign says they're open till 1AM, and I went to the drive thru at 10.37 and the lady said they were already closed. Smh"
192,OMG The reviews are spot on. The workers asked us 3 times to repeat my order. Super slow service. The guy was high as a kite. Forgot my soda. I just wanted...
193,Horrible place to eat. Lobby was always dirty. Never had food prepared I thought this was supposed to a be fast food place? Employees were like animals!!!...
194,"Wow this place was a joke when I was trying to order my food the kids just played on the mic like the movie ""dude where's my car"". Then when I pulled up to..."
195,"Sooo disappointed. Been seeing the comercial for their famous bowl all week. I go through the drive thru, bring it home, open it up and bam!!! A bowl full..."
196,It's rare that I give a review like this but every now and then it occasionally happens. My coworkers wanted chicken and chose KFC so I played along. I...
197,"I wasted a cheat day on this place, I needed something fast for lunch and the drive-thru here was empty around noon. I ordered their spicy Nashville chicken..."
198,This is the worst KFC i have ever been to. Ever. Bar none. The only reason I keep coming back is because my wife loves KFC and theres not a closer one. We...
199,"My 4th KFC tonight to see how the new KFC Fried Chicken Donuts Sandwich is being received by the public. I am now in upscale Richardson, TX after stopping..."
200,"The reviews here are true that the customer service is pretty bad here. When they lost my order they didn't even apologize, just said ""it's really busy.""..."
201,"So this establishment just closes when it wants to; I saw no signage about holiday hours in your drive thru, so you just don't have any regard for your..."
202,it was 4:00pm i went up there and there was 4 vehicles in the drive-thru so i decided to go in and all the doors were locked. so i look in the windows and...
203,"WARNING: Please avoid eating at the following #KFC location 2802 E Ledbetter Dr, Dallas, TX 75216. As I write this my eyes are filled with tears. My mother..."
204,"Food was stale and hard, and I'm hoping my vision is bad, because I think I saw maggots in the chicken"
205,"Second visit just as horrible as first This was my second visit, on the first visit the bathroom spells like bad plumbing or someone had just done a number..."
206,Places need to stop combining two restaurants into one. The KFC chicken tenders look like theyre from a bag of frozen chicken strips bought at walmart. The...
207,What a sad place... I went in and ordered hot wings and two individual mashed potatos. Went and sat down and waited. Had ticket number 4531 and waited...
208,Just ordered my food and when I got home I realized that I am missing a taco . So my order isn't complete . I ordered the meal t8 that comes with 3 tacos...
209,"Customer service from this particular location is very odd in every way. On 6/5/2020 at 7pm, I placed an order online for pickup. I pulled up to drive..."
210,"I loved KFC as a kid and decided to go to this location and reminisce a bit. I ordered the number 15 , I believe and whoaaaa. I should have known better bc..."
211,"Management sucks. I think they need to look up what the meaning of customer service is. I will not be back. Man, I have to give you'll a star to post my review"
212,We've been to this location many times and they're usually very good. However the last couple of times has not been very good. The coleslaw has tasted old...
213,This is now my second time at this KFC location and both times I've had to wait 5 to 10 minutes for my food to be brought to me outside of the...
214,"Went thru drive thru about 2 PM for hot wings. Before I could complete my order, the lady yelled back ""I have to see if I have any we just had a lunch..."
215,Nope!. Dont do it! The people that exterminate here wont even eat here! Just filthy! Employees could care less. I have never seen a place run like...
216,"Food is not very good and everytime we go they forget to give us something. We have had whole meals missing almost everytime. I know, we shouldn't go back...."
217,"Out of chicken at dinner time, with long waits and terrible service. Counter was empty and waited server all minutes for someone to even acknowledge the..."
218,Don't fucking spend your money here. These A holes re-fried my wings after I requested them to be made fresh. They were extremely hard and greasy. Fucking...
219,"I refuse to write a orderly review. I'll just give y'all a list. 1. Close it Down. Knock it down, build a payless. 2. Not clean, rude, slow, loud..."
220,"No no no, never again. Went through drive through. Was asked to pull forward and wait on order. Started noticing several cars pulling up and waiting. Sat..."
221,The experience I had here was so bad that I don't ever want to go to a fast food restaurant AGAIN. I hold fast food restaurants to a lower standard and this...
222,"So, you have an attitude in drive thru but I'm suppose to just hand you my money. I will nlnot be coming back here until their customer service improves."
223,"KFC used to be my go to chicken house. Growing up loving to eat at KFC, but my last few experiences have been so horrible, it pretty much made up my mind on..."
224,To be quite fair I typically don't yelp generic fast food chains. I stopped here on my way home about an hour ago just to try the mac & cheese bowl. I got...
225,Chicken over cooked and tasteless. Ordering online is a complete mess. Don't recommend.
226,I will never go back in this lifetime or the next. Treat people with respect. Fear dogs and not people.
227,"Slow to take order, hard to understand, refused to replace side, this place is getting ridiculous nowadays."
228,"I ordered the 4 pc chicken tender combo. the chicken was dry, pieces were too small, and the iced tea didn't have ice in it. I asked the young lady taking..."
229,"Don't order chicken pieces here, or maybe at any KFC for that matter. They apparently only want to sell you tenders. I ordered two piece meal, leg &..."
230,Are they even still open? Everytime I go there is no one there. States closes at 10 it's 9:28pm and no one answered the drive thru nor the phone lol. They...
231,I'm sorry but if I could put a 0 I would. This place is so horrid.. I've been living in Grand Prairie for many years and every time my family and I come...
232,"I don't know how this place is still in business. I went through the drive thru, it took over 15 minutes for me to get my food and that's only after I had..."
233,i got there 35 minutes before closing time and the lady said they ran out of everything. i asked her if she had anything in the back and she responded...
234,no windwr3this location has a 1 1/2 star..my friend just left there and ince arriving home discovered he was given cole slaw instead of green beans that he...
235,Went through the drive thru and lady had an attitude and started rushing me while I was ordering then I had an item missing so I walked inside and the...
236,"Terrible-lady comes on and sounds like this is the worst place she has ever worked out. They were out of everything I tried to order dark meat, hot wings...."
237,"I find it criminal that items listed on the menu board are short changed upon receiving them. We ordered 12 chicken wing Box, and only got 10. Tried to call..."
238,"This place would be the place to go around this neigborhood till a while back. They had a hispanic male that would get your orders and be very polite, not..."
239,Slow slow slow. And of course they got the order wrong. Had to join the drive thru line again and wait forever again. Would be ok if the people inside today...
240,Just picked up a 3 pc meal with drink to take back to work for lunch. First issue I ordered unsweetened tea and the tried to give me sweet tea. Tasted it...
241,"Pathetic is the first word that I will use, I was celebrating one of my employees anniversary and I ordered $60 worth of food from this location through..."
242,If I could give this location minusone I would it was an absolute horrible experience. First I come through the drive-through and I had a coupon and I...
243,"This was the absolute worst take out dining experience I've ever had in my life. My family & I waited in the drive through line about twenty minutes, I saw..."
244,"The food was terrible. The chicken tenders were cold, the breading was soggy, and the biscuits were hard. It tasted like they were prepared and kept under a..."
245,"Overall KFC is pretty good. Last couple times I went, toward the end of the night, they never have any white meat available. I understand not having enough..."
246,"HORRIBLE CUSTOMER SERVICE. I just ordered a meal that came with a thigh and a drum, and I was told they don't have anymore drums. I simply asked if I can..."
247,The people working in window needs to be trained well about customer service. I had my order wrong and when I told her she did not apologize . She corrected...
248,I should've listened to the reviews. I don't often get KFC but for whatever reason I had a craving and this was the closest location. I got the $20 fill up...
249,I came to the drive-thru at this KFC after watching and reading several of chef's episodes of parts unknown and articles because of his love for the mac and...
250,Never going back..ordered $5 fill up box with wings..cost $7.52..asked for a ranch and hot sauce..the cashier said....27 cent each..I politely asked for my...
251,If I could give this location a negative 0 stars I would. They are a hot mess every time i go. They sell you hot wings but want you to pay for the ranch...
252,This is undoubtedly the worst KFC in all of Houston. I don't understand why it's still in business. After 3 bad experiences I've had enough. Experiences...
253,i just want to let you know i spent $30 dollars at your store and threw most of it in the trash. this well be the last time i visit that location. i have...
254,Real bad attitude from start to finish as HE twist away. And really think color is his determining factor. Horrible place won't be back again because I...
255,"This is the second time they got my order wrong and seems they do it on purpose. Went their one night about month ago, ordered a K3- 3 piece meal. Get to..."
256,[3/16/2016] Don't come here... just don't. This place has a good price. But the food is absolutely nasty and bland. The Resturant is VERY DIRTY! How do...
257,Literally hate this location ! They had me wait for ever to bring out all my food wrong and I'm missing items to have me wait AGAIN and it was still WRONG!!...
258,On 3 separate occasions I asked for Potato Wedges but got mashed potatoes. The 3rd time was this evening. Good thing I checked my order before pulling off.
259,This place is horrible they don't even know what an Arnold Palmer is and then when you tell them what it is they want to charge you extra. Their staff...
260,"Yes I'm writing a review for KFC, so yes, it's ridiculous in itself. But this location forgets items in our order every. single. time. Unbelievable."
261,Always slow and always missing at least one item and god forbid you let them know cause then you are met with attitude. Food is usually pretty good...
262,Them drive through workers got the nastiest attitudes! Almost lost my temper . If you don't like your job take your behind home. I'm not understanding how...
263,Dont come here the drive thru is so slow! Are they importing my chicken grease from fucking rome?! It's ridiculous that myself and 4 other cars have been...
264,"Pass. I haven't had KFC in a while, but this one seems to be closest to me. Rude people, bad food, and in a sketchy part of town. I just wanted..."
265,Omg! I don't frequent KFC but a couple of days ago I did because my job is the next business over. Besides the fact that they close the lobby at 6pm ‍. Me...
266,I wouldn't recommend no one else to come by this KFC. Not a good place to eat the workers forget to put all your food that you order just rude & disrespectful..
267,Okay so fast food places don't really get my expectations high anyways but this place is absolutely trash. The whole establishment is horrible from the food...
268,"I was sent to review this place and customer service could be better . Not impressed, the staff was not wearing masks too so there's that"
269,"Horrible service. The person who attended me was being overall rude and told me to hurry up and finish my order. If you're working in fast food, you should..."
270,"Consistency would be nice, sometimes we can order the large family meal $20+ and we don't want the biscuits sometimes they will let me sub fries (cost can't..."
271,"This location is the worst ever, and after several attempts to ""forgive and forget"" it continues to have poor, negative management/staff customer service...."
272,The food was HORRIBLE. Chicken was dried! Biscuit was hard. The gravy in the mashed potatoes did not look like gravy at all. All I have to say is that I...
273,At this stage in my life I try to look for any silver linings or even remotely positive experiences to pull out of what are otherwise not the best...
274,"If this had a minus star , that's what I would give this place‼ The chicken was absolutely disgusting, slimy not crispy at all, and granted , I had not had..."
275,"WAITING FOREVER, I might be exaggerated but we just order two cups of fries, and we are waiting for about 30/40mins in the drive thru. Not to mention we..."
276,This is the worst KFC I have ever been to. The older white lady that's suppose to be to the manager is nasty and has the rudest attitude. The black lady...
277,"Ken took lots of drugs, but it wasn't until Ken Took E, that he invented this chicken, before changing his name to Colonel Sanders. What I had no taste..."
278,Sooo I went here a few days ago been meaning to write a review but haven't had the chance...... I tend to try to be positive but that's kinda hard when u...
279,Well this was not my choice to come but ordered something anyway. It's in a difficult place in a u turn unless you're going the right way. The building and...
280,This place has horrible service. They mixed up all orders during lunch crowd. Then lady wants my receipt because all orders were erased. Got a 3 piece...
281,"Idk what happened to this place but the food sucks, the staff sucks and the whole place sucks. The chicken looked like reheated-driedout crust stuck to the..."
282,"In this photo you'll see a garbage can, dirty pans and raw chicken left out next to it. Just paid $40.58 not for my family to eat food left next to garbage..."
283,"Customer service as always not good. Teas were not made at the time of visit. No grilled chicken was available, & the restrooms were locked with a sign..."
284,"Well, I did it again. I came back to this KFC and again I ordered the 10 hot wings. This time I was informed that the credit card machine was down, no big..."
285,"This may have ruined my KFC experience forever. I occasionally eat fast food, but I was craving a chicken bowl. I decided to get the Famous Spicy Chicken..."
286,I went inside to order my meal.. thinking it would be easier..but no... they still forget... I understand that it's just a freaking biscuit and a...
287,Got tired of waiting was there for past 40min. They came outside confirmed my order and still took forever so I just left.
288,"It's been on a downhill slide for some time now at this store. The service gets worse and worse. Saturday, September 1, 2019 was my very last visit......."
289,"Stopped at this location as it is on my way home from work, I ordered the $30 fill up which is supposed to come with 4 biscuits. I did not have any biscuits..."
290,"Welp. Over time the quality slowly disappoints. I was sooo excited to see the ""KFC Wings"" so I ordered the buffalo sauce... it's supposed to be tossed in..."
291,Very disappointed. I just went there and ordered the hot wings #5. The wings were soggy and tasted like they were warmed up in the microwave not fresh at...
292,The only good thing about KFC is the bottle water. Now I remember why I literally haven't been here in years.
293,"This location is probably the worst one in all of Houston. This is the third time I've been here and each time they're out of half of the menu, get my order..."
294,"Rude. Went to order through the drive through and as I was stating my order, the employee just goes and said ""and"". I wasn't sure what they had said so I..."
295,"They got my order wrong, didn't get my drink with my five dollar fill up. There was no corn on the famous bowl. It wasn't the chicken bites it's was..."
296,Horrible service tonight ask for a simple 3 soft tacos with no lettuce I get sour cream tomato's didn't ask for that then a bean burrito with no onions I...
297,How is this place so bad. How is literacy so difficult. Every time these folks don't know their own menu. I've gotten to the point where I literally...
298,Only half of a biscuit. No gravy with my mashed potatoes. Chicken tasted weird. Half the cookie was hard. This is the 5 dollar box. I had WAY better from...
299,Stopped there to get chicken. We really do like KFC.. food was okay but the service sucked. The girl at the window just shoved the bag at me didn't even...
300,"Waited in line to get my food for 30 minutes. I got there at 6:19 and didn't get my food until 6:50. I first pulled up and the lady nicely said ""order when..."
301,"If I can give it a zero star oh baby I would!, I've been going to this kfc for a while and I knew some employees that were nice but man!!! I go today around..."
302,"On my way home from work I picked up some KFC for my husband and daughter. Once home, I noticed that the potato wedges were hard as rocks and clearly old...."
303,"This place is horrible. I've come here 3 times in the past few weeks and everyone time with our fail, they get my order wrong. They forget food that I..."
304,"Tried to eat there two weeks ago, no chicken available. 20 minute wait. We decided to go elsewhere. Last visit was very similar. You could tell that the..."
305,"I always like the hot wings from this place but today was horrible, I got the wings and they were still bloody, cut 2 of them and they both were not cooked..."
306,"Slow, mean, 0 customer service. If you have a long order they will make a comment that ""you should have come in to order this"". Keep the comments to..."
307,Stopped there to get chicken. We really do like KFC.. food was okay but the service sucked. The girl at the window just shoved the bag at me didn't even...
308,It always smells like cleaning agent or bleach when I go in the actual store (at night). My parents like fried chicken so I go here to pick some up since...
309,"Rude, indifferent shift supervisor. I placed an order at the drive thru and was told someone would bring it out to me. I waited. And waited. And finally,..."
310,"The cashier was totally rude, he give me a wrong order. Looks like they aren't happy working at kfc"
311,"Ordered two orders of the Nashville hot chicken. One of the chicken strips wasn't cooked all the way through, had pink in the center"
312,I understand I went around closing time but KFC was still open the wait and food were absolutely horrible. I asked for a 5$ fill up tender box with wedges...
313,"I never do reviews but this lady in the drive thru was so RUDE that I must say something. She would not let me finish my order before saying ""anything else""..."
314,"No no no the chicken sandwich was crap!! It was dry, hardly no chicken I'm soo disappointed"
315,Slowest fast food place I have ever been to in my life. 5 minute wait turned into a 20 minute wait for 5 wings. Wtf
316,I give it a one because if was to work here I would see why a man's body was lying outside.. I felt bad for that person.
317,This place is simply horrible and should close permanently. They are a disgrace to the chain.
318,Literally no one should ever come here end it should be shut down or something the drive-through employee was so rude and disrespectful obviously the line...
319,"We ordered doordash from this KFC tonight. My husband got one of those fill up boxes with a drumstick and a thigh and I swear, from the size, they could..."
320,This kfc is trash i waited for about an hour when I had ordered online and it said my order was ready the staff is rude especially this black old lady I'm...
321,Don't visit this KFC location if you can help it. It definitely is worth the extra time that it takes to visit another location. The staff are extremely...
322,"Disappointing. Very disappointing. We normally order Popeyes since its closer to us, but I wanted to change it up. Ordered the $30 (which came to about..."
323,Do not go to this location if you're cautious about catching corona. Drive thru cashier doesn't fully cover nose with masks and no gloves. Cooks doesn't...
324,I was the only person in line and was asked to wait. Waiting is fine with me but it appeared there wasn't anything going on behind the counter. I can't say...
325,"Stopped in to try the donut and chicken special. Was nothing to write home about, but it's KFC, so that's par for the course. What was stranger than getting..."
326,"Wow another one. I know it's hard, but mask are made to be worn over both mouth and nostril. This guy was breathing all over my food. When I called him out..."
327,"Worst experience ever! My fries came out cold and overly salty, so I asked the lady for some fresh ones that weren't so salty and she told me I ate one...no..."
328,This was my first time stopping by here. I went through the drive thru and the employee named Susanna was incredibly rude. She pretty much answered with...
329,WOW.. the feeling of watching the food prep box and bag your dinner without bothering with gloves or any other item to keep customers safe.. Normally I...
330,This location is completely mismanaged. The staff should be trained how to properly handle food and beverage. An employee touched my beverage with her bare...
